<!--
# Copyright (c) 2017-2019 The University of Manchester
#
# This program is free software: you can redistribute it and/or modify
# it under the terms of the GNU General Public License as published by
# the Free Software Foundation, either version 3 of the License, or
# (at your option) any later version.
#
# This program is distributed in the hope that it will be useful,
# but WITHOUT ANY WARRANTY; without even the implied warranty of
# MERCHANTABILITY or FITNESS FOR A PARTICULAR PURPOSE.  See the
# GNU General Public License for more details.
#
# You should have received a copy of the GNU General Public License
# along with this program.  If not, see <http://www.gnu.org/licenses/>.
 -->
<algorithms xmlns="https://github.com/SpiNNakerManchester/PACMAN"
		xmlns:xsi="http://www.w3.org/2001/XMLSchema-instance"
		xsi:schemaLocation="https://github.com/SpiNNakerManchester/PACMAN
			https://raw.githubusercontent.com/SpiNNakerManchester/PACMAN/master/pacman/operations/algorithms_metadata_schema.xsd">
    <algorithm name="ConvertToJavaMachine">
        <python_module>pacman.utilities.file_format_converters.convert_to_java_machine</python_module>
        <python_class>ConvertToJavaMachine</python_class>
        <input_definitions>
            <parameter>
                <param_name>machine</param_name>
                <param_type>MemoryMachine</param_type>
            </parameter>
            <parameter>
                <param_name>file_path</param_name>
                <param_type>JsonMachinePath</param_type>
            </parameter>
        </input_definitions>
        <required_inputs>
            <param_name>machine</param_name>
            <param_name>file_path</param_name>
        </required_inputs>
        <outputs>
            <param_type>JsonMachine</param_type>
        </outputs>
    </algorithm>
</algorithms>